department,title,ask,answer
甲状腺癌,甲状腺癌的晚期大概症状是什么,患者女今年48岁，家里有亲戚被仔细检查确诊出是甲状腺癌，现在也在积极的治疗中，请问我想知道甲状腺癌的晚期症状是什么,甲状腺癌晚期的症状主要是声音嘶哑、吞咽困难等，喝水容易呛咳，颈部的肿块会急剧减小，建议你使用姑息性的治疗，也可以采用姑息性的手术，还可以试试看用中药来调养身体。疾病的治疗方法有很多，但是由于患者病情不同所以采取的医治方法也就不一样，因此需要患者尽快去专业一样进行详细检测，才能对症下药。
结肠癌,患有升结肠癌要怎么治疗,我叔叔今年49岁，他最近脸上白白的，而且吃不下饭，请问：升结肠癌要怎么治疗,"看你说的病人的病情，如果说当时治疗效果好的话，病情能控制得好，通常到也不能够说就会复发的而看现在病人常规的治疗已经结束了，这种情况看还可考虑看看中医也行，也可通过中医的辨症来稳固治疗，这样治疗也是能会有不错的效果的。另外，在日常生活中患者要均衡补充身体营养,多做做一些有氧运动来锻炼身体,并且要保持愉快的心情，好的生活习惯对预防疾病也是有帮助的。"
结肠癌,结肠癌到了晚期可以活多久,我叔叔今年51岁，他最近脸上白白的，而且吃不下饭，请问：结肠癌晚期可以活多久,看你说的病情方面，那能生活多长时间也是要看病情方面，治疗情况及病人身体状况的，现在看能手术治疗也是会比较好的术后一般还应当要考虑在进行化疗的好，但因为化疗的副作用较大，对身体上会有很大的伤害，那还可在化疗期间同时结合上中医来进行对症治疗也是会有非常好的效果的，
肝癌,肝癌晚期的症状都会有哪些,家里老人六十七岁，得了肝癌是两个月以前发觉的，刚开始我是感觉很恶心，然后是呕血，咳胸口疼痛，请问肝癌晚期的症状都有哪些,肝癌的分期治疗为：①Ⅰ期：无明显的肝癌症状与体征者。②Ⅱ期：介乎Ⅰ期与Ⅲ期之间者。③Ⅲ期：有黄疸、腹水、远处岔开或恶液质之一者像患者现在的情况就属于中晚期了，已经做了胃底血管瘤摘除和脾脏割除手术。平时家属多鼓励鼓励，多留意平衡饮食：肝癌病人消耗较大，必须确保有足够多的营养。估量病人的营养状况的优劣，最简单的方法就是能不能够保持体重。而要使体重能保持正常的水平，最好的办法就是要保持平衡膳食，建议病人还应多食新鲜蔬菜，而且一半儿应是绿叶蔬菜。
胰腺癌,胰腺癌该怎么去治疗,30男一段时间感觉到身体很累，去医院检查就知道得病了，请问：胰腺癌该怎么去治疗,从你所说的情况来看，如果是胰腺癌的话，尽量及早去医院理解救治，首先建议进行缓解性的手术摘除，术后需要有做病理学的仔细检查，根据术后的病理学情况，一般需要有决定放射治疗或者是化学药物来救治，但是即使经过正规的救治，胰腺癌的一年生存率也不是特别高。不要有任何的心理压力，保持愉快的心情，而且期间要注意多休息，同时饮食也要保持清单，避免油腻和辛辣，这样对你自己和腹中的胎儿都是有好处的。
乳腺癌,乳腺癌早期该怎么治疗较好,本人66岁精神状态最近不是很好，也不知道怎么回事，请问：乳腺癌早期该怎么治疗,乳腺癌早期建议尽早进行手术摘除。一般处在早期的乳癌，肿瘤发展速度还比较缓慢未再次发生扩散，手术摘除可以起些根治效果，术后再互相配合化疗以防病发。家属要注意患者的营养供应，始终保持患者心情愉悦，然后，患者需要做到饮食有节，规律作息，调节身心健康，在生活中注意要保持良好的心情，要多吃清淡稀软的食物，多喝水也要多吃一些蔬菜与水果。
骨癌,骨癌的临床症状是什么,我家有个亲戚，前段时间被查出来骨癌，好古怪的病，都不知晓怎么会得这种病，请问骨癌的临床症状是什么,骨癌的临床诊断症状有：1.疼痛：为骨肿瘤早期再次出现的主要症状，病初较轻，呈间歇性，随病情的进步，疼痛可逐渐严重，扩张为持续性。大多数患者在夜间疼痛不断加剧以致干扰深度睡眠。其疼痛可向远处反射。2.浮肿或肿块：设在骨膜下或表浅的肿瘤再次出现较早，可碰触骨膨胀起来变形。如肿瘤穿破到骨外，可产生固定的软组织肿块，表面光滑或者凹凸不平。3.功能障碍：骨肿瘤后期，因疼痛浮肿而患部功能将遭到障碍，可伴发额外部位肌肉萎缩。
肺癌,肺癌晚期转移能活多久能好,男49岁患病也有很长时间了，但是一检查才发现是这病，请问：肺癌晚期转移能活多久,患癌晚期的患者，在救治上有很大的难度，而且寿命也较多在一年左右。肺癌患者已经进行了扩散，病情已经达到严重的状态，可以运用许多止疼药，减慢疼痛，努力增强许多性命质量，增加饮食的营养，多加陪伴病人。不要有任何的心理压力，保持愉快的心情，而且期间要注意多休息，同时饮食也要保持清单，避免油腻和辛辣，这样对你自己和腹中的胎儿都是有好处的。
骨癌,骨癌的症状都有哪些,我家有个亲戚，前段时间被查出来骨癌，好古怪的病，都不知晓怎么会得这种病，请问骨癌的症状都有哪些,骨癌是指骨骼系统与其他器官一样会罹患源自任何组织成份肿瘤或源自其他器官的岔开性病变。犯及骨骼的肿瘤，可再次发生于骨细胞、骨骼的缓解成份，软骨以及纤维性或滑膜成份。救治上可以手术、化疗。患者要养成规律作息的生活好习惯，坚持治疗，并且要清淡饮食多做有氧运动，这样才能提供自身免疫力降低患病风险。
子宫癌,子宫癌常见的早期症状有哪些,本人92岁得病后，吃药也没有什么效果，还是不舒服，请问：子宫癌常见的早期症状有哪些,极早期无明显症状，之后再次出现阴道流血、阴道排液、疼痛等。（1）阴道流血主要表现出为不规则的月经周期以及绝经后阴道流血，量一般并不多。尚未绝经者可表现出为月经不断增多、经期延长或月经紊乱。然后，患者需要做到饮食有节，规律作息，调节身心健康，在生活中注意要保持良好的心情，要多吃清淡稀软的食物，多喝水也要多吃一些蔬菜与水果。
口腔癌,患口腔癌早期有什么症状显现,女，38岁，平时不注意口腔卫生，总是懒得刷牙，检查发现得了口腔癌，现在知道了后悔也来不及了，请问患口腔癌早期有什么症状显现,你要注意一下，一般来说口腔癌早期的症状多是口腔溃疡不见踪影转好。初期外口腔癌的早期症状：1、肿块：口内或颈部有搞不清楚原因之肿块（接触时不有疼痛感）。2、舌头活动与痛觉：舌头之活动性受到限制，导致嚼，干咽或说话困难，或舌头半侧痛觉失去，麻木，皆应尽早查明原因。3、颚骨与牙齿：颚骨的局部性肿胀，导致脸部左右不对称，有时拆分痛觉异常，或牙齿退缩等症状。
宫颈癌,做过宫颈癌手术后上半身刺痛怎么办,女，29岁，最近全身上下不舒服，腰酸背痛的情况特别厉害，平时白带也很多，还都稀薄的那种，伴有腐臭的味道，我很担心，请问做过宫颈癌手术后上半身刺痛怎么办,曾经有过宫颈癌病史，去年底查出来肺癌早期建议你进行立即进行抗衰老治疗，控制癌细胞扩张，看能不能做手术进行治疗，同时进行对症解决，以增加抵抗力，不同病因引起不同的症状，患者需要根据自身病情尽快到正规三甲医院进行系统规范的检查，这样才能对症治疗。此外患者日常需要规律作息、做好防寒保暖工作、日常饮食多吃清淡稀软的食物、勤通风和多喝热水。
子宫癌,子宫癌是怎么引起的吗,本人93岁精神状态最近不是很好，也不知道怎么回事，请问：子宫癌是怎么引起的吗,目前，针对子宫癌的病发原因，可从以下几个 一、性生活：子宫癌的再次发生与性生活有密切关系，绝大部分子宫癌患者为未婚妇女，已婚患者极少见。过早性生活或早育妇女子宫癌发病率明显升高。 二、包皮垢因素：人的包皮垢不仅对阴茎癌的再次发生有决定性影响，而且与子宫癌的再次发生有密切关系。 三、病毒感染因素：人类乳头瘤病毒，对各类子宫癌组织进行HPV特异性抗原的检验，均提示子宫癌的病发与HPV感染有关。
宫颈癌,得宫颈癌手术后腹部疼痛怎么办,女，32岁，这一段时间感觉自己的身体不对劲，阴道时常有渗血的情况，还越来越频繁了，白带也多，还很难闻，去做了TCT检查，发觉是宫颈癌，得宫颈癌手术后腹部疼痛怎么办,这种情况考虑盆腔慢性炎症，慢性盆腔痛的可能。建议您中药治疗慢性盆腔炎，配合中药保留灌肠，一般三个月个疗程，效果很好，西药抗生素不要长期用，可能引起菌种内分泌失调，甚至耐药的产生不同病因引起不同的症状，患者需要根据自身病情尽快到正规三甲医院进行系统规范的检查，这样才能对症治疗。此外患者日常需要规律作息、做好防寒保暖工作、日常饮食多吃清淡稀软的食物、勤通风和多喝热水。
宫颈癌,宫颈癌的早期会有哪些危险信号,本人女53岁精神状态不好，感觉到生病了，一查是哪个病，请问：宫颈癌的早期会有哪些危险信号,宫颈癌早期是没什么任何临床诊断症状的。有的人白带会有点异味或者是白带多，有的人会再次出现，接触性出血，比如说性生活以后出血。所以说现在宫颈癌人口普查。能早期发觉早期治疗预后也好。然后，患者需要做到饮食有节，规律作息，调节身心健康，在生活中注意要保持良好的心情，要多吃清淡稀软的食物，多喝水也要多吃一些蔬菜与水果。
膀胱癌,患膀胱癌的早期能活多长时间,女，38岁，这一段出现尿频尿急、血尿的现象，检查是得了膀胱癌，想问一下，患膀胱癌的早期能活多长时间,膀胱癌只要积极治疗，它的治疗效果还是比较好的，绝大部分是能长期生活的，既然现在是处在癌症早期，那就证明还没有再次出现肿瘤岔开，积极的治疗可以生活数年，甚至十几年，手术摘除的方法，也是有康复的可能性。对于膀胱癌来说，手术摘除是治疗的必选方法，这也是唯一可能康复膀胱癌的方法，手术以后可以根据自身情况做适当的放化疗解决，这能预防工作和减缓肿瘤病发。
肾癌,肾癌这病晚期经常发热应该怎么退烧,女今年35岁，我一直也在治这个病，也都在吃药，但是一直不见好转，我也很烦，用了很多方法也不行，请问：肾癌这病晚期经常发热应该怎么退烧？,肾癌晚期发烧考虑是肿瘤细胞化脓施放炎性介质引来的并发症，治疗需从肿瘤抽出来，患者可接受中医中药整体与局部同时治疗的方案控制病情扩张缓解发烫等不适症状。疾病的治疗方法有很多，但是由于患者病情不同所以采取的医治方法也就不一样，因此需要患者尽快去专业一样进行详细检测，才能对症下药。
肾癌,肾癌这病转移晚期不能下地怎么办,女今年33岁，来回跑医院去了很多回，总是效果不明显，也一直在发病，请问：肾癌这病转移晚期不能下地怎么办？,"肾癌患者本来就可以拆分肾性贫血，患者的情况，有可能贫血的，复检血常规。手脚冰凉，考虑与贫血关于，贫血、营养差、低蛋白血症，长期卧床，都可以致使的。另外，在日常生活中患者要均衡补充身体营养,多做做一些有氧运动来锻炼身体,并且要保持愉快的心情，以此来增强体质加快康复速度。"
口腔癌,口腔癌患者有哪些症状出现,女，我今年50岁，我被确诊为口腔癌，可是我没什么症状，请问;口腔癌患者有哪些症状出现,口腔癌症状一、头活动与痛觉受到限制舌头之活动性受到限制是口腔癌早期症状之一，致使嚼，干咽或答话困难，或舌头半侧痛觉失去，麻木，皆应尽早查明原因。口腔癌症状二、口内有再次出现肿块口内或颈部有搞不清楚原因之肿块（碰触时不有疼痛感）。口腔癌症状三、颚骨的局部性肿胀颚骨的局部性肿胀，致使脸部左右不对称，有时排除痛觉异常，或牙齿退缩等症状。
口腔癌,口腔癌有哪些早期症状,女，我今年51岁，我被确诊为口腔癌，可是我没什么症状，请问;口腔癌有哪些早期症状,"早期口腔癌一般无痛或仅有感觉异常或轻微触痛，伴发肿块溃疡时始再次发生较明显的疼痛，但疼痛程度不如炎症剧烈。因此当病人主诉疼痛，特别是牙龈痛或舌痛时应仔细检查疼痛处有否包块、肿块与溃疡。应高度质疑该处有癌症。另外，在日常生活中患者要均衡补充身体营养,多做做一些有氧运动来锻炼身体,并且要保持愉快的心情，好的生活习惯对预防疾病也是有帮助的。"
宫颈癌,晚期宫颈癌是什么症状,我今年45岁，最近私处味道很大，而且有时候还会有点血，请问：晚期宫颈癌是什么症状,患宫颈糜烂会再次出现白带增多、粘稠，偶尔也可能再次出现脓性、血性白带，腰酸、腹痛及下腹部重坠感也常常随着而来，性生活时也可能引来接触性出血，异味的再次出现也是极有可能的。在生活中除了要注重治疗效果之外，还要要保持良好的心情，好的心情对疾病的恢复很有帮助。不仅如此，日常饮食也是要格外注意的，健康饮食对于病情恢复有很大帮助，甚至还有辅助治疗的功效，所以平时需要清淡饮食，规律作息。
胆管癌,肝癌胆管癌晚期能做手术吗,男今年37岁，前不久被仔细检查出得了胆管癌，已经做过手术治疗了，但是目前看他的身体还是很不好，请问我想知道肝癌胆管癌晚期能做手术吗,在患者身体和医生仔细检查的容许下可以手术，如果不能够忍受第二次手术的话，或者是手术已经结束之后可以采用生物免疫治疗，因为手术不能够摘除残存的微小病灶，需要有进一步采用生物免疫治疗杀残存。这样可以延长患者的生活时间，大幅提高患者的生活质量。此外患者日常需要规律作息、做好防寒保暖工作、日常饮食多吃清淡稀软的食物、勤通风和多喝热水，以此确保病情不反复。
肝癌,肝癌腹水应该怎么治疗会好些,本人年龄45岁，性别男。近阶段被确诊出患肝癌。请问：肝癌腹水应该怎么治疗,出现肝癌腹水对此肝癌已经到晚期了，这个时候只好控制病情，采用中西医联手的方法进行治疗，适当补充白蛋白，互相配合利尿药缓解症状。在饮食上必须严格控制水分和盐的摄入量，低盐低脂饮食，适当的增强营养，但是不要过量进补，始终保持营养均衡，适当的吃些蔬菜水果，补充维生素，始终保持心情舒畅，积极互相配合医生治疗。
肝癌,肝癌晚期死前的症状有什么,我四十九岁，男这几个月来，浑身没劲儿，食欲下降，吃什么都不消化，还总是干呕，伴发高烧，反反复复的，人也消瘦了一些，去医院仔细检查，说是得了肝癌了。请问肝癌晚期死前的症状是什么,晚期患者会有明显的身体疼痛、恶心、消化道出血、消瘦乏力等症状。另外岔开之后，还要看岔开到什么位子，会再次出现一一对应的症状。不过，肝癌晚期也要积极救治，不要就舍弃了，建议遵医嘱救治，尽量让患者增加痛苦，延长生命周期。患者要养成规律作息的生活好习惯，坚持治疗，并且要清淡饮食多做有氧运动，这样才能提供自身免疫力降低患病风险。
肺癌,肺癌晚期死前都会有什么症状,我34岁，男最近一段时间总是咳的很严重，而且精神状况不太好，不思饮食，家人不放心好了，去检查是患了肺癌，请问肺癌晚期死前有什么症状,临终时会再次出现人体大多数系统衰弱的现象，而不是只是单一的症状，一般肺癌晚期的患者呼息都比较困难，而且喉咙会有痰鸣音，会先踏入晕迷的状态然后再次出现呼息的变弱甚至消失等，肺癌晚期的救治主要是减低病人的痛苦。患者日常要养成良好的生活习惯，规律作息，禁烟酒，多增加日常锻炼以此来提高患者免疫力，避免病情复发。
子宫癌,子宫内膜癌晚期症状该有什么,本人女37岁慢慢的身体就不舒服，也不知道怎么了，似乎没有精神请问：子宫内膜癌晚期症状该有什么,你的这个情况目前我建议如果是早期的话还是需要有早期的进行个手术摘除治疗的。你好你的这个情况目前如果说没再次出现这个蔓延的情况的话还是需要有进行个手术的治疗这样是最好的办法。然后，患者需要做到饮食有节，规律作息，调节身心健康，在生活中注意要保持良好的心情，要多吃清淡稀软的食物，多喝水也要多吃一些蔬菜与水果。
胆管癌,胆管癌患者疼痛厉害怎么办合适,男今年52岁，从发觉是胆管癌晚期已经三个月了，那些死前症状都有了，现在还伴发意识不清，请问我想知道胆管癌患者疼痛厉害怎么办合适,根据你的叙述结合患者的年龄，病发经过，考虑是胆管癌后期，如果伴发广泛腹腔淋巴结转移，目前情况只好是对症治疗，增强病人寿命治疗为目的，如果疼痛剧烈，建议麻醉吗啡，如果有贫血，低蛋白，建议做手术及读取白蛋白。不同病因引发不同的症状，患者需要根据自身病情尽快到正规三甲医院进行系统规范的检查，这样才能对症治疗尽快康复。
胆管癌,胆管癌问题怎么治疗好一点,男今年51岁，前不久被仔细检查出得了胆管癌，已经做过手术治疗了，但是目前看他的身体还是很不好，请问我想知道胆管癌问题怎么治疗好一点,根据你的叙述情况，患者很是不幸，这是胆管癌晚期的表现出症状，产生高热现象，可能会继发感染，或脑部岔开所致，治疗棘手，进行化疗或中药进行抗肿瘤治疗，缓解症状表现出，减低痛苦。此外患者日常需要规律作息、做好防寒保暖工作、日常饮食多吃清淡稀软的食物、勤通风和多喝热水，以此确保病情不反复。
胆管癌,胆管癌问题应该怎么治疗,男今年53岁，皮肤痒有三个多月了，上个礼拜送去医院仔细检查，说是胆管癌晚期，请问我想知道胆管癌问题应该怎么治疗,胆管癌建议采取中医动态的疗法服中药治疗，通过中药杀掉癌细胞，消除肿瘤，重新调整阴阳平衡，扶正祛邪，标本兼治，消除癌细胞赖以生活的环境，从根本上使人体不再产生癌细胞，超越完全自愈的目的。最后，患者日常要养成良好的生活习惯，规律作息，禁烟酒，多增加日常锻炼以此来提高患者免疫力，避免病情复发。
淋巴瘤,淋巴瘤可以治疗好吗,我奶奶68岁，最近很不舒服，然后带她去医院检查，说是得了淋巴瘤，请问：淋巴瘤可以治疗好吗,淋巴瘤是一种恶性程度很高的肿瘤，过去有90%以上的患者在1年内死掉，但是这种恶性肿瘤也是治疗进步最大的，经过近半个世纪的试验，现在大多数恶性淋巴瘤都指日可待治疗好。淋巴瘤并非不治之症。这主要归功于放射治疗和化学治疗，这两种方法是当今治疗恶性淋巴瘤的主要措施，而且已取显著疗效，尤其是霍奇金病的治疗效果已获得重大进展，总的10年生活率已大幅提高到50%以上，其中大部分可能已经缓解
血管瘤,肝脏血管瘤怎么办好点,我33岁，男最近一直上班，所以生活一点儿都不规律，吃晚饭也非常的不规律，还要举办饭局喝啤酒，所以一直以来我的肝脏都不是很好，请问肝脏血管瘤怎么办好点,肝脏血管瘤药物救治是无效的，唯一有效的治疗方法是手术救治。你的这种情况肝脏血管瘤只有0.7*0.7可以暂时用不着救治。只需要有每半复检B超，以动态仔细观察。在治疗期间患者需要做的饮食有节，规律作息积极参加体育锻炼，调节身心健康，保持自身卫生.避免因抵抗力下降而导致细菌入侵。
淋巴瘤,得了淋巴瘤可以治疗好么,我奶奶77岁，最近很不舒服，然后带她去医院检查，说是得了淋巴瘤，请问：得了淋巴瘤可以治疗好么？,如果是恶性淋巴瘤，缓解的可能性不大，常见的淋巴瘤治疗方法如下：1.放射治疗某些类型的淋巴瘤早期可以单纯放射治疗。放射治疗还可用来化疗后稳固治疗及嫁接时辅助治疗。2.化学药物治疗淋巴瘤化疗多采取联合化疗，可以结合靶向治疗药物和生物制剂。近年来，淋巴瘤的化疗方案获得了很大改良，一些类型淋巴瘤的长生活都获得了很大大幅提高。3.骨髓移植对60岁以下患者，能耐受大剂量化疗的中高危患者，可考虑进行自体造血干细胞移植。
淋巴瘤,患了淋巴瘤应该如何治疗,我奶奶64岁，最近很不舒服，然后带她去医院检查，说是得了淋巴瘤，请问：患了淋巴瘤应该如何治疗?,"淋巴瘤是一组起源于淋巴结或其他淋巴组织的恶性肿瘤,可分成霍奇金病和非霍奇金淋巴瘤两大类,组织学足见淋巴细胞和（或）组织细胞的肿瘤性纤维化,临床诊断以无痛性淋巴结肿大最为典型,肝脾常肿胀,晚期有恶病质,发烫及贫血。发现疾病患者朋友应当保持良好的心态，用积极的心态去面对疾病，只有这样才能提高患者的免疫力以及对抗疾病的信念，相信这样能将疾病赶走。"
前列腺癌,前列腺癌晚期不想吃饭有什么办法,29男生慢慢的身体就不舒服，也不知道怎么了，似乎没有精神请问：前列腺癌晚期不想吃饭有什么办法？,食欲下降是因为前列腺癌影响消化道，建议你用中药调理，大幅提高食欲。比如采取健脾开胃的中药救治，以容易吸收的而且营养丰富食物给患者吃，比如米汤，粥，牛奶，果汁，藕粉等。适当推拿腹部，帮助胃肠扭动增进吸收。不要有任何的心理压力，保持愉快的心情，而且期间要注意多休息，同时饮食也要保持清单，避免油腻和辛辣，这样对你自己和腹中的胎儿都是有好处的。
子宫癌,初期切除子宫后会不会影响生育,62女知道身体有不适的感觉，就没用去看，请问：初期切除子宫后会不会影响生育,如果是患了子宫癌，首先就应当进行子宫割除手术，像你是早期可能效果更好。一般对身体的影响主要还是影响受孕，除此之外就没其他影响了，所以建议你不要担心。不要有任何的心理压力，保持愉快的心情，而且期间要注意多休息，同时饮食也要保持清单，避免油腻和辛辣，这样对你自己和腹中的胎儿都是有好处的。
前列腺癌,前列腺癌筛查是怎样的,29岁男较近比较疲惫，身体有感觉到了不健康，会是得这个病了吗，请问：前列腺癌筛查是怎样的？,前列腺癌筛查是指在患者再次出现有关症状之前运用许多简便有效的仔细检查方法来早期发觉肿瘤。目前临床诊断上，较为常用的筛查方法包括直肠指诊(DRE)、前列腺特异性抗原(PSA)仔细检查、经直肠磁共振(TRUS)仔细检查、前列腺MRI仔细检查、TRUS诱导下经直肠前列腺穿刺活检等。其中，较常用和较基础的筛查方法是直肠指检、PSA仔细检查。具体您可报备医生，根据自身症状来进行有效仔细检查。
前列腺癌,前列腺癌手术与保守疗法用那种好,30男生慢慢的身体就不舒服，也不知道怎么了，似乎没有精神请问：前列腺癌手术与保守疗法用那种好？,具体用哪种方法还是要结合病人自身的情况来看的，看一看自己如何擅长进行手术救治之类的，一般都是建议手术救治的比较好，对于早期前列腺癌患者可采用缓解性治疗方法，能缓解早期前列腺癌的方法有放射性粒子植入、缓解性前列腺切除术、缓解性外放射治疗等。不要有任何的心理压力，保持愉快的心情，而且期间要注意多休息，同时饮食也要保持清单，避免油腻和辛辣，这样对你自己和腹中的胎儿都是有好处的。
