department,title,ask,answer
甲状腺腺瘤,得了甲状腺瘤好治疗吗,一段时间感觉到他身体很累，去医院检查就知道得病了，请问：得了甲状腺瘤好治疗吗,甲状腺瘤是临床诊断常见病、多发病，其中绝大部分为良性炎症，极少数为癌。甲状腺良性肿瘤除功能自主性甲状腺瘤以外病程缓慢，临床诊断上可以无任何自觉症状。故建议测甲状腺功能，及刺击细胞学仔细检查，排除毒性甲状腺腺瘤，及甲状腺癌。排除前两者，可以受孕后再予手术。当然也是可以母乳喂养的。腺瘤病情很严重，建议患者及时治疗，期望患者可以根据医生的意见对症治疗。同时看重饮食问题，防止辛辣刺激食物，以免加重病情。上述的答案期望可以帮助到您。
甲状腺腺瘤,看甲状腺瘤的办法哪个效果较好,他来回跑医院去了很多回，总是效果不明显，也一直在发病，请问：看甲状腺瘤的办法哪个效果较好,对于甲状腺囊肿的治疗方法这个问题一定要看重。你提及甲状腺囊肿的治疗方法的问题，为你解惑如下。甲状腺囊肿是指在甲状腺发觉所含液体的囊状物，该囊状物可能很小(甲状腺瘤通常没症状，除非囊肿很大或囊肿内有破皮的现象，这时可能引发一些控制的症状，如疼痛、吞咽困难、呼吸困难、声音沙哑等。在超音波仔细检查下可以发觉囊肿内可能全部被液体所充满，或除了液体以外还所含一些实质的固体物质，或因为甲状腺有很多血管，有时候囊肿内还会有破皮的现象。
血管瘤,肝内血管瘤囊肿怎么办？,我孩子大半年前感冒过一次，高烧了几天，去医院看了，查出得了肝内多血管瘤，当时在医院接受治疗，治疗了快两个月左右，复查时又发现肝内有小囊肿，我很担心他的身体，想请问下肝内血管瘤，囊肿怎么办？,朋友您好，现在主要是肝血管瘤合并有肝囊肿，如果是小于四厘米的话，暂时不用治疗，先观察比较合适，对身体影响不大，如果是大于了四厘米以上，那就建议使用手术治疗，手术切除肝血管瘤和肝囊肿，这样就可以恢复了，这些疾病和感冒高烧没有关系，暂时先观察比较合适。
肿瘤疾病,高胆固醇黄瘤病怎么治？,我的爷爷最近检查，高胆固醇引起的黄瘤病，全身制的，能获得控制吗？,黄色瘤通常系指发生在皮肤或肌腱部位的黄色或橙黄色斑丘疹或结节，在黄瘤组织中常所含脂质组织细胞和巨噬细胞浸染。控制高脂血症，进低脂饮食，多采取低胆固醇及低饱和脂肪酸饮食治疗。可给与降脂药物。此外，心脏疾病患者在治疗期间，患者的饮食状况和护理也是很关键的，患者一定要留意歇息，可以适当活动，以免引发不必要的伤害，期望上述的答案可以帮助到你，谢谢。
肿瘤疾病,黄瘤病胆固醇好降下来吗？,我的好朋友胆固醇高引起的黄瘤病，看着他挺痛苦的，胆固醇好降下来吗？,饮食上关键是控制油脂的摄取。尤其是动物性脂肪的摄取了。平时留意少吃油、多吃水果蔬菜、多吃粗纤维食物、戒烟酒。祝您早日康复。期望有帮助心脏疾病病情很严重，建议患者马上实行治疗，期望患者可以根据医生的意见对症治疗。同时看重自身的护理工作，恰当饮食，以免加重病情。上述的答案期望可以帮助到您，谢谢。
小儿血管瘤,婴儿血管瘤会自己消退吗？,医生你好.我家的小男宝宝现在三个月大了.然后最近被检查出有血管瘤.我想问一下就是.婴儿血管瘤能自己消退吗？有什么需要注意的地方吗？,对于血管瘤.是一种良性肿瘤.起源于皮肤和血管。对于长时间未出生的婴儿.这可能是由激素水平引起的。这种血管瘤一般很可能会自行消退.但如果生长相对较快.这种情况需要尽快去医院检查.采取激光或冷冻疗法.必要时考虑手术.平时注意预防该部位如果遇到血管瘤.可能会导致出血.您可以去找专业人员。该机构进行检查并遵照当地医生的建议。
血管瘤,血管瘤肝囊肿治疗会有危险吗？,最近一段时间常常感到腹痛，特别是肝部位，身体状况明显下降，工作也没有状态，人消瘦得非常厉害，结果到医院被查出肝部有血管瘤，想请问医生，血管瘤、肝囊肿治疗会有危险吗？,朋友，血管瘤和肝囊肿如果不是很大的话，一般是不会有危险的，他并不会引起什么特殊的临床症状，如果比较大的话还是建议进行手术切除的，因为药物是对这个病情没有办法缓解的。还有一点是手术期间，不要吸烟喝酒，实在术后完全恢复的情况下，也建议每半年到一年体检一次。
血管瘤,血管瘤患者在平时饮食上要注意些什么？,我患上了血管瘤，但我平时很喜欢吃各种各样的东西。所以想问一下平时饮食上要注意些什么？这样我好避开那些我不适合吃的东西。,您好，血管瘤患者生活要有规律，不要熬夜，生活饮食合理。平时注意饮食要清淡一些，可以多吃营养丰富，好吸收，好消化的食物。多吃新鲜的蔬菜水果，多吃鱼肉，瘦肉，鸡蛋，豆制品等。不要吃生冷，油腻，油炸，腌制，烟熏类等食物。可以适当的锻炼身体，增加自身的免疫力。
血管瘤,血管瘤复发症状有什么？,我女儿出生的时候就有一个血管瘤长在手臂上，她三岁多的时候动手术治疗了，但是她现在六岁了，我感觉好像有点要复发，血管瘤复发症状有哪些？,这位家长您好，血管瘤复发症是一种良性血管内皮细胞增生性疾病，既往由于人们的认识不足，易把血管瘤与血管畸形混淆，两者都是常见的新生儿血管疾病，如果感觉要复发的话，我还是建议你带孩子到当地的医院进行一下复查，看看是否是真的复发了。避免病情加重。
血管瘤,血管瘤有恶性的吗？,医生，你好。我今年三十八岁了，最近我感觉我身体很不舒服，所以我就去医院做了检查，结果医生跟我说我患上了血管瘤，是良性的，所以我想问问血管瘤有恶性的吗？,您好，朋友，血管瘤大多数是良性瘤，一般木有恶性的，注意皮肤清洁卫生，别磕着碰着，免得引起感染，精神放松，生活规律，禁止吃刺激性食物，别吃垃圾食品，霉变食物以及烧烤的食物，最去医院做进一步检查，可以考虑手术，激光治疗，做好术前检查，术后防感染。
血管瘤,血管瘤会危害孩子的健康吗？,我家宝宝七个月了，最近发现头皮上边起了一个小疙瘩，去医院看了是血管瘤，孩子还这么小我很担心，请问大夫，血管瘤会危害孩子的健康吗？这个病严重吗，,您好，血管瘤对人体的健康影响并不是很大，是属于一种良性的肿瘤，小的血管瘤，不需要特殊治疗，定期复查就可以。如果血管瘤的尺寸比较大，一般保守治疗效果欠佳，需要通过手术处理，手术安全性很高。按照临床医生的医嘱下来，进行对症治疗。手术以后做好常规性的调理措施。
血管瘤,血管瘤治疗费用要多少?,朋友家宝宝出生的时候，脸上就一个红色的胎记，主要是害怕影响将来长大之后的面容效果，所以，去医院咨询，医生说他这种属于血管瘤，需要等稍微大一点做手术治疗，请问血管瘤的治疗费用，大概需要多少呢?,血管瘤的治疗费用主要取决于血管瘤的类型。草莓状血管瘤体表的治疗最简单，有的可自发消退，有的可局部注射硬化剂或局部外用药治疗。一般来说要到当地的医院咨询一下可以解决这个问题。内脏海绵状血管瘤相对复杂且费用昂贵。一些血管畸形发生在四肢，往往需要介入治疗，甚至结合手术治疗。
血管瘤,大人血管瘤症状是怎样的？,同事从今年年初开始就总说自己的头部疼的厉害，疼起来的时候没完没了的，而且浑身冒冷汗，一直在吃止痛药顶着。后来止痛药都有些不顶用了，去医院检查，医生说看着像是得了脑部血管瘤，让去大医院再确诊一下，大人血管瘤症状是怎样的呢？,您好，血管瘤的症状是比较多的，最常见的就是鲜红色的或者是紫红色的斑块，海绵状的血管瘤没有一些很明显的症状，而且生长比较缓慢的柔软的肿块，而且会呈一种蔓延状的血管瘤，肿瘤高起来，像蚯蚓一样的形状。同时会和皮肤表面平齐或者是稍微搞起来，边界比较清楚，形状不规则，大小不等。
血管瘤,血管瘤是什么症状？,我女儿已经十六岁了，她平常身体都还好。前几天去做体检，医生说我女儿患了血管瘤，我真的很担心我女儿。但是我又弄不清楚血管瘤有什么症状，因为我并没有发现我女儿平时有什么异常。希望医生给我解释一下血管瘤是什么症状？,您好，血管瘤的类型包括毛细血管瘤，其中大部分为错构瘤。它们可以在一年内停止生长或消退。所以你可以观察它们。如果没有明显的增加，应该在一年后进行治疗。其次是卷须状血管瘤和海绵状血管瘤，其特征受深部组织状态的影响。它们通常呈红色或与之相关的肿块。
小儿血管瘤,肝部血管瘤治疗方法有哪些？,2006年体检查出肝部血管瘤四到五个厘米.现在复查已达八到九个厘米.复查一直在长.一直未治疗.采取何种方法治疗最好,肝血管瘤一般不影响肝功能。大血管瘤有不均匀的网状回声.有时有钙化。电脑断层扫描、核磁共振、核素血池扫描等检查有助于诊断。指南:肝活检经常会导致严重出血.这是肝活检的禁忌症。如果体积过大.可能压迫外周血管.如胆囊、胰腺、胃等。.并引起某些症状。如果肝血管瘤超过6厘米并加速增大.为了防止破裂和大出血.应手术切除。
甲状腺腺瘤,甲状腺瘤该怎样治疗康复转好?,近期常感觉胸闷，不着觉，抖，便次数增多，重偏瘦，为是心脏功能不医院检查发现是甲状腺腺瘤，在想知道，甲状腺瘤该怎样治疗康复转好?,你好，中药是不可能好的，见建议：，甲状腺瘤只有手术才可能治且有潜在恶变性，建议尽快手术治疗，中药只是百花钱和精力，瘤对患者们带给的伤害是非常大的，一旦发觉自身的症状，要及时就诊诊病，多看重饮食问题，清淡食物为基础，望腺瘤患者能获得专业治疗。
小儿血管瘤,半个月宝宝血管瘤怎么治疗？,鼻头有血管瘤在皮下看了两家医院一家说先吃激素进行保守治疗.等到半岁以后再依情况进行激光.情况选择什么样的更安全保守不复发呢?,血管或血管畸形的治疗应根据病变类型、位置和患者年龄等因素确定。目前的治疗方法包括外壳切除、放射治疗、激素治疗、低温治疗、激光治疗、硬化剂注射等。综合疗法的一般应用应观察婴儿血管瘤。如果发展迅速.应及时给予一定的干预治疗。
血管瘤,血管瘤患者在平时饮食上要注意些什么？,我患上了血管瘤，但我平时很喜欢吃各种各样的东西。所以想问一下平时饮食上要注意些什么？这样我好避开那些我不适合吃的东西。,您好，血管瘤患者生活要有规律，不要熬夜，生活饮食合理。平时注意饮食要清淡一些，可以多吃营养丰富，好吸收，好消化的食物。多吃新鲜的蔬菜水果，多吃鱼肉，瘦肉，鸡蛋，豆制品等。不要吃生冷，油腻，油炸，腌制，烟熏类等食物。可以适当的锻炼身体，增加自身的免疫力。
小儿血管瘤,血管瘤怎么治疗较好啊？,大母指外侧.圆形有弹性.干活多了会有麻木感觉.颜色发青。曾经的治疗情况和效果：没有治疗过想得到怎样的帮助：有简易的办法治疗吗？,不是说血管瘤必须治疗吗.首先.你必须看看它的检查结果。如果它不大.它对你的生活影响很小。你可以先观察它。注意你生活中应该注意的事情.比如饮食、情绪、劳动等。定期检查是好的.但是如果超过5厘米.你仍然需要治疗。如果是在广州.建议你去广州南洋肿瘤医院治疗.那里有专家！
血管瘤,血管瘤都是良性的吗？,医生你好，我今年42岁了，女。我最近这段时间的脸色看上去特别苍白的，我的老公特别担心我就陪我去做了检查，是血管瘤，想问一下血管瘤都是良性的吗？,您好，血管瘤大部分都是良性的，一般不会引起生命危险的。但是如果长的位置不好的话，有可能会影响到气管功能的，所以要根据情况来及时对症治疗。常用的治疗方法也是很多的，比如用激光，冷冻，手术的。所以如果长了些话，留的话也要去有条件的医院检查治疗。
血管瘤,血管瘤的患者血压低能补血吗？,最近我特别的头晕，身上一点劲也没有，休息的时候会好一些，一运动就特别的累。结果是因为血压低导致的。我是一个血管瘤患者，想和医生咨询一下，血管瘤的患者血压低能补血吗？,您好，血管瘤的患者血压低是可以补血的，但是最好是在医生的指导下进行补充，你目前的情况可能需要服用药物，在日常生活中可以吃一些菠菜猪肝之类的，也是有补血的作用的，血管瘤的情况，可以考虑去当地比较正规的医院做手术切除，一般尽早的进行手术，风险会比较小。
血管瘤,宝宝血管瘤问题有哪些？,我的宝宝五个月了，在他三个月大的时候我老公就发现孩子颈部后面的开始有一块像胎记一样的东西，后面慢慢变得深红色，现在确定是血管瘤了。请教一下宝宝血管瘤问题会有哪些？,朋友您好，血管瘤的话一般是良性的，一般没有什么临床症状，所以都说宝宝如果没有什么不舒服的话，比如说没有哭闹发热，不吃东西的话，我们可以不必管它，如果是出现这种情况的话，我们可能要去，当地妇幼保健院的外科进行治疗，把血管瘤给切掉。一般预后都挺好。
小儿血管瘤,新生儿颈部海绵状血管瘤要怎么治疗,左颈部皮下扫4.4*0.7低回声包块.边界尚清晰.呈网格状.内探及丰富的动脉及静脉血流。说是海绵状血管瘤怎么治疗啊,海绵状血管瘤的损害一般较大.自发发生.发生于原始毛细血管血管瘤或皮肤下.圆形或不规则形.可高于皮革表面.呈结节状或小叶状.边界不清晰.柔软而有弹性.多呈紫色或紫蓝色.挤压后可减少.皮肤表面正常或粘附于肿瘤和萎缩建议及早手术.注意1.保持宝宝身体清洁.经常洗澡避免出汗湿表皮血管瘤。毛细血管血管瘤具有浅表上皮血管瘤.表皮非常薄。如果长时间浸泡在汗液中.很容易折断。另外.父母洗澡时要特别注意.不要刮擦婴儿的血管瘤。2.经常给宝宝指甲。婴幼儿喜欢to抓手.尤其是脸部。因此.应经常修剪婴儿的指甲.以免刮伤血管瘤。
血管瘤,新生儿肝血管瘤如何治疗？,我家的宝宝从生下来，已经几个月了，看着都很健康，吃奶什么的都很正常，可是最近这几天发现他有些总是哭，好像哪里疼今天到医院，带她去检查，大夫说得了肝血管瘤，新生儿肝血管瘤怎么治疗？,朋友您好，其实新生儿出现肝脏血管瘤肯定是可以治疗，但很难达到完全治疗，因为血管瘤主要就是通过活血疏通的方式来纠正，哪怕是做手术也不能说绝对可以治疗容易复发，肝脏血管瘤体积比较小的话，一般来说问题都不大。小孩子先天发生的话，只能是观察或者手术。
血管瘤,血管瘤有哪些表现?,你好，医生。今天我去医院检查身体，才知道我有很长一段时间的血管瘤，但是我从来都没有了解过这种病，不知道这种病的表现是什么，血管瘤有哪些表现？,朋友您好，大多数血管瘤是由血管畸形引起的。如果没有破裂出血，一般不需要特殊治疗。定期复查就足够了。其次，注意监测血压，防止高血压的发生。一般来说，问题并不是特别大和正常的生活。如果后期血管瘤有进行性增大，可考虑手术切除，且恢复较快，无大碍。
血管瘤,海棉型血管瘤该怎么治？,医生，你好。孩子以前身体很好的，这两年可能是压力太大了，身体出了很多毛病。昨天她被确诊为海棉型血管瘤，我想问一下，海棉型血管瘤该怎么治啊？,您好，像你老婆有海绵状血管瘤，一般像这样的血管瘤是进行手术治疗就可以了，比较有效的治疗就是手术治疗，一般像这种情况可以到当地的当地的医院进行的，平时要注意个人的饮食，尽量不要吃辛辣刺激性的食物，要注意多运动锻炼身体，提高体质，保持良好的心情。
血管瘤,血管瘤的症状是什么？,我家孩子刚出生不久，可是我却发现他的脸颊靠近耳朵的部位有一块红色的印记，我听同事说有些孩子出生后可能会有血管瘤，就是这样的，所以我比较担心，请问血管瘤的症状是什么？,您好，这位朋友，您小孩子的血管瘤通常并没有什么异常的症状的，目前还是比较小，这种情况只能是选择注意观察，看血管瘤是否逐渐的增大，如果增大比较明显的情况下，可以选择进行激光处理的，建议等孩子3，4岁左右的时候，如果出现增大的情况就尽早进行处理。
血管瘤,肝上有血管瘤平时应注意什么？,医生你好，我的孩子5岁了，男。我近这段时间的肝脏一直都很不舒服的那种，肝上原来是出现了血管瘤，我也不知道该怎么办好，想问肝上有血管瘤，平时应注意什么？,您好，现在主要是肝脏血管瘤，认为是一种良性病变，需要根据血管瘤的大小来分析，如果是肝血管瘤小于了4厘米，暂时不用治疗的，先观察合适，平时不能剧烈运动，如果是血管瘤大于了4厘米，就建议用微创介入手术治疗的，手术后才能控制疾病的，避免影响身体健康。
血管瘤,嘴唇血管瘤如何确诊？,孩子被查出来有嘴唇血管瘤，但是血管瘤的种类有很多，体检报告又没有详细说明，那么嘴唇血管瘤如何确诊类型及最佳治疗方法？,您好朋友，现在主要是嘴唇的血管瘤，是一种良性病变，可能会出现嘴唇部位的红色包块，对身体是有一定影响的，如果不治疗，有可能会发生破裂出血，必须要尽快做激光去除治疗比较好，这样才能够好转，如果是有其他疾病的存在，那就需要对症治疗，避免影响身体健康。
血管瘤,新生儿血管瘤怎么办？,老婆在怀孕40周才顺产生的女儿，住院3天我们就出院了。回家一周左右看到女儿鼻子上有点红，没多注意。一周后变大了，去看医生说是血管瘤。新生儿血管瘤怎么办？,您好，新生儿血管瘤一般不用担心，目前注意观察，它不会对身体造成不良影响的，可以到十周岁以后采取激光或冷冻方式治疗，治疗效果比较好。以后多补充营养，加强体育锻炼，改善体质，心态积极乐观，学会释放不良情绪，让孩子养成良好习惯，有可能会预防复发的。
血管瘤,主动脉血管瘤可以手术吗？,我小妹这段时间经常无缘无故的昏倒，好几次都吓得送去急诊，后来实在是受不了，去省立医院做了检查，医生说是主动脉血管瘤，现在血管瘤的大小已经压迫到神经，请问主动脉血管瘤可以手术吗？,现在主要是主动脉血管瘤，血管瘤比较大，已经压迫到了神经部位，所以对身体的伤害是存在的，需要积极治疗，一般建议采用手术切除治疗，但是手术的风险特别大，很容易造成严重出血，所以要做好准备，平时注意休息，避免劳累过度，合理。饮食，预防各种疾病的发生。
血管瘤,主动脉血管瘤如何治疗？,孩子被确诊为患有。主动脉血管溜，请问主动脉血管瘤该如何治疗呢？这种病可以治疗后痊愈吗？还是治疗后会有一些其他的并发症，甚至是导致后遗症？需要长主要呢？这种病治疗起来难不难？,您现在主要是主动脉血管瘤，对身体是有一定影响的，容易引起血管瘤的破裂，对身体是有一定影响的，所以一般建议使用手术治疗比较好，但是这个手术是有一定风险的，对身体的影响是很大的，所以需要注意的，需要根据自身的情况来分析，然后选择合适的药物治疗。
血管瘤,女孩3个月额头上有一血管瘤可以手术吗？,我家表姐有个孩子三个月了，在额头上发现了血管瘤，但是孩子太小，不知道怎么办才好，所以特意来问一下医生女孩3个月额头上有一血管瘤可以手术吗？,您好，这位家长朋友，现在主要是孩子额头部位的血管瘤，如果血管瘤突出皮肤表面，而且比较大的话，那就需要用手术切除治疗的，手术切除后使用抗生素药物，预防发生感染，手术以后可能会留下面部的疤痕，将来可以使用去疤痕的药物，或者是手术治疗，这样才能够恢复的。
血管瘤,脸部血管瘤怎么治？,我男朋友的妹妹想知道脸部血管瘤怎么治，他最近查出了这个病，是不是需要去医院挂号跟医生进一步交流？如果没有去医院治疗会不会有什么不好的后果？,这位朋友您好，现在是脸部血管瘤，发生在面部以后会严重影响了美观，会出现了面部的红色包块，影响了面部的美观，一般需要使用激光去除治疗比较好，有利于疾病的控制，如果不治疗的话，血管瘤还会有继续生长的现象，这个身体的危害是比较大的，所以需要注意的。
血管瘤,肝内血管瘤囊肿怎么办？,我孩子大半年前感冒过一次，高烧了几天，去医院看了，查出得了肝内多血管瘤，当时在医院接受治疗，治疗了快两个月左右，复查时又发现肝内有小囊肿，我很担心他的身体，想请问下肝内血管瘤，囊肿怎么办？,朋友您好，现在主要是肝血管瘤合并有肝囊肿，如果是小于四厘米的话，暂时不用治疗，先观察比较合适，对身体影响不大，如果是大于了四厘米以上，那就建议使用手术治疗，手术切除肝血管瘤和肝囊肿，这样就可以恢复了，这些疾病和感冒高烧没有关系，暂时先观察比较合适。
血管瘤,肝血管瘤该怎么治疗？,医生你好！我的儿子最近感觉到腹部有包块，很没有食欲，到医院检查，医生说是患上了肝血管瘤，建议进行手术切割，请问医生，肝血管瘤该怎么治疗？可以不进行手术治疗吗？,您好，这位朋友，现在主要是有肝血管瘤，如果是肝血管瘤比较大，那就认为是很容易压迫周围的组织，所以出现了腹部的包块，没有食欲，需要去医院就诊，必要时需要用手术切除血管瘤，这样就可以控制疾病的，如果是不做手术，是不能控制住疾病的，所以在平时需要注意的。
血管瘤,得了成人面部毛细血管瘤怎么办？,医生，我女儿是一个皮肤比较白皙的人，所以脸部的血管经常清晰可见，这几日突发不适，我带孩子去医院，医生说我得了瘤，请问得了面部毛细血管瘤怎么办？,您好，现在主要是成人面部毛细血管瘤，发生在面部会影响美观，会出现皮肤的红色包块，会突出皮肤表面，所以对身体的影响是很大的，一般建议使用手术治疗比较好，手术切除后使用抗生素药物，如果将来面部留下了疤痕，那就需要使用去疤痕的药物或者是疤痕贴治疗。
血管瘤,检查出肝血管瘤怎么办？,医生你好，我想请问一下医生，检查出肝血管瘤怎么办？就是可能和我的生活习惯有关。然后我去医院检查出患有肝血管瘤，我到底该怎么办，能不能够治疗呀？这个病。,朋友，现在主要是有肝血管瘤，认为是先天性发育不良后引起的良性病变，大多数是没有任何症状，也可以出现了肚子胀，肚子不舒服，消化不良等，需要去医院做个肝血管瘤检查，如果是肝血管瘤很大的，那就需要用微创介入手术治疗的，治疗两到三次后就可以控制疾病的。
血管瘤,什么是婴儿血管瘤？,我的高中同学生了一个非常可爱的女儿，最近有朋友去他家看望他的女儿，发现小孩的鼻翼有红色的血丝，眼睛上也有红色的血丝，就跟我同学说这可能是婴儿血管瘤。我的同学非常的着急，我们想知道什么是婴儿血管瘤？,您好，现在孩子主要是有鼻翼部位血管瘤，一般认为是一种良性病变，会出现了身体皮肤的红色斑块或包块，发生在面部后影响美观，所以需要尽早检查和治疗的，对于血管瘤，需要用激光切除治疗的，这样就可以好转的，需要去医院皮肤就诊，然后在医生的指导下治疗的。
