department,title,ask,answer
血管瘤,肝血管瘤会不会转移有生命危险吗？,叔叔今天突然晕倒了，去医院检查医生说他得了肝血管瘤，我们也是第一次听到这样的病，他们说这个属于癌症，一听到这个大家都受不了，所以想问一下肝血管瘤会不会转移有没有生命危险啊？,肝血管瘤是肝脏疾病中常见的良性病变。如果血管瘤相对较小并且没有明显不适，则无法进行任何特殊治疗，但应每3至6个月进行随访和复查。能够。如果血管瘤较大，则有明显的压迫症状，或有恶变的趋势，可以进行手术。血管瘤早期的时候症状并不突出，对身体的影响一般不会很大，所以很难被发现。对于早期肝出现血管瘤的治疗，可以用中药治疗。
小儿血管瘤,海绵状血管瘤的治疗方法有什么？,脚面上皮下直径3―4厘米.表面颜色正常出生时不明显随着人长大曾经的治疗情况和效果：用尿素局部注射4疗程.现在停了.瘤子发硬了但没发现明显变小这种治疗有用吗能根除吗,你好。被称为海绵状血管瘤者。实质上是静脉畸形。是由充满血液的血窦和薄壁静脉所构成的皮下暗红或蓝紫色病灶。形态大小各异。随着畸形静脉的多少和走行不同而有多种表现。不波及皮肤指导意见：海绵状血管瘤的治疗：对于较稳定的先天性静脉畸形。应以美学治疗为原则。尤其在暴露部位的瘤体。尽可能选择微创治疗。
血管瘤,鼻部血管瘤要注意什么？,医生，我得了鼻部血管瘤，我现在已经是有接受治疗的了，而且治疗的效果还是比较乐观的，所以我想要问问您，鼻部血管瘤要注意什么？我有哪些方面是需要注意的呢？,鼻子有血管瘤。如果您生气或喝酒，可能会由于血管瘤破裂而引起出血。鼻子血管瘤患者可以吃更多富含维生素的食物。不要熬夜，不喝酒，不吃辛辣食物，少喝碳酸饮料，如果您有鼻塞的症状，应该及时服用消炎药，建议最好是在医生的指导下来进行用药，选择适合自己的治疗方法。
血管瘤,请问这是肝血管瘤吗？,医生你好，请问一下这是肝血管瘤吗？我因为工作岗位的原因，时常要应酬的，刚开始觉得没什么，后来就觉得是有腹胀食欲不振，呕吐等。有试过调整饮食，酒也少喝了。效果不太显著。,腹胀，腹部恶心和呕吐，可能是由胃，肝和胆囊疾病引起的，不吃辛辣食物，不喝酒，多吃新鲜蔬菜和水果，需要去医院做腹部超声检查肝功能，对症治疗，肝血管瘤属于良性肿瘤，对人体影响不大。定期检查并在必要时进行手术。不要吃油腻食物和油炸食物。建议去三甲医院比较有所保障
血管瘤,肝血管瘤的用药需要注意哪些问题？,医生，我患有肝血管瘤，上个月已经去医院做过一次手术了，现在还在调养中，医生开了好多药我回家吃，这些药物呢我就用的比较谨慎，请问当血管瘤的用药需要注意哪些问题呢？医生能给我说一说吗？,肝血管瘤，药物治疗的相对效果不好，血管瘤一般不需要特殊治疗，如果能定期得血管瘤，药物治疗的相对效果不是很好，一般需要激光手术对症治疗，因此，药物语言基本上无效，可以根据自己的具体情况进行治疗，必要时可以进行激光手术。患者平时要注意清淡易消化饮食，避免剧烈活动和重体力劳累，定期复查肝脏超声。
血管瘤,肝血管瘤有什么好的治疗方法吗？,我爷爷今年已经是72岁的高龄了，在年前的时候就检查出了肝血管瘤，一直都在治疗，但是不见什么好转，所以想咨询一下医生，肝血管瘤有什么好的治疗方法吗？,如果肝血管瘤不是很大，可以口服药物治疗。如果应及时治疗肝血管瘤，可以服用一些保护肝脏和保护肝脏的药物。工作日不要剧烈运动，以免引起血管瘤。出血，不要在饮食上吃辛辣刺激性食物，不要抽烟喝酒，不要熬夜，要定期去医院。多吃一些富含营养之品，多选用维生素和镁类含量丰富的食物
血管瘤,肝血管瘤的治疗和保养方法有什么？,医生你好，我这几个月以来身体状况就一直不是很好，去医院检查了，结果竟然说是得了肝血管瘤。想问医生肝血管瘤的治疗方法和保养方法有什么？我平时应该注意什么？,相对较小的病例，肝血管瘤可以不予治疗，对身体没有影响。它可以动态观察，只需要定期检查肝脏彩色多普勒超声即可。如血管瘤持续增加，加重，腹胀，肝部不适等。建议药物治疗以消除症状并控制生长。通常，您应该注意保持情绪稳定。不要每次都生气和焦虑，不要吃清淡的食物，少吃辛辣的食物，不要吸烟和喝酒。
血管瘤,关于血管瘤冷冻的效果如何？,伯伯得了血管瘤已经十几年了，去看了很多的医生也没看好，他实在很痛苦，都准备放弃治疗了，但是最近他听说血管瘤冷冻的效果很好，他又有点希望了，所以想问关于血管瘤冷冻的效果如何？能治疗吗？,如果有血管瘤，如果血管瘤相对较小，则可以选择进行冷冻治疗。但是，如果血管瘤相对较大，则这种情况下的冷冻效果非常差。通常，主要选择激光治疗，或者是手术治疗的选择，还是根据血管瘤的具体大小选择合适的治疗方法。现在治疗血管瘤的方法很多，只要治疗方法得当，治疗期间多加注意治疗时要到正规医院检查就诊
血管瘤,血管瘤治疗要多少钱？,我不知道最近是怎么回事，经常头晕，有时去工作挤地铁时感觉头脑目眩的，很难受，索性就去医院检查了，医生说是得了血管瘤，需要及早治疗。那血管瘤治疗要多少钱？,你好，很高兴为你解答：血管瘤一般是良性的，可能是这个血管瘤都出现的位置不好，造成了身体血液循环不畅，引起的头晕，目眩。血管瘤治疗费用与具体的部位有很大的关系，这与手术难度有关，一般情况下费用可能是需要一两万元之间，即使这样也应该找一家口碑好恋情的医院，找一个有经验的医生，因为手术有一定的风险，如果处理不好可能会遗留下问题。
血管瘤,肝有血管瘤要怎么办比较好,单位体检做了腹部超声，说怀疑肝有血管瘤，所以自己又做了一个腹部的增强CT，也是报了肝血管瘤。请问医生，这个肝血管瘤需要治疗吗，是不是得手术啊，做检查的医院医生说可以观察，请问医生我需要怎么做啊。,肝血管瘤本身是一种良性病变，不要太紧张，如果很小则无明显症状，无需治疗，定期肝B超检查三个月至六个月，看是否有任何生长，如果常规复查过程发现它相对较大。例如，如果直径大于五厘米，则可以考虑手术或介入疗法。通常，使用微创干预，并且不需要紧张。
血管瘤,肝血管瘤是良性的还是恶性的？,我丈夫最近患上了肝血管瘤，肚子上有包块，按着也不疼，也不知道什么时候就有了，我想问问医生，这个肝血管瘤是良性的还是恶性的？肝血管瘤的病因是什么？,肝血管瘤是一种良性疾病。发生肝血管瘤时，不会消融腹部。通常，肝血管瘤需要通过检查确定。肝血管瘤的详细病因尚不确定，通常与先天性发育和某些药物的使用有关。肝血管瘤发生后，可根据程度进行手术。这种情况的话最好是在医生的指导下来进行治疗比较好，不要吃辛辣食物，多注意休息休息。
血管瘤,肝多发性血管瘤严重吗？,我前阵子听到我一个亲戚患了肝多发性血管瘤，听着挺吓人的，但毕竟自己不是专业人士，也不敢妄下定论，免得吓到了病人，所以就想咨询一下医生这个肝多发性血管瘤严重吗？,肝血管瘤本身是一种良性病变。如果很小，则不需要特殊处理。当然，多发性血管瘤需要认真对待。必须警惕血管瘤出血的可能性。如果没有肝多发性血管瘤的明显症状，还应定期检查以查看其生长是否有任何变化。如果肝脏中的血管瘤相对较大或多发，直径大于5厘米，则可以考虑手术或介入治疗。
血管瘤,发现肝血管瘤怎么办？,医生您好，我今年46岁。我想问问您，就是如果发现肝血管瘤我应该要怎么办？是不是要动手术？希望您可以快点回答我，谢谢您了。发现肝血管瘤怎么办？,肝血管瘤通常是良性的。处理方法需要结合大小进行综合判断。如果它仍然相对较小并且不超过5厘米，则通常不需要进行处理。您可以每六个月做一次肝B超检查。看具体尺寸。通常尽量少喝酒，不要生气，避免熬夜，如果现在检查超过五厘米，个人建议可以考虑微创手术。
甲状腺癌,甲状腺癌长在峡部危害,我有个问题，我得的是甲状腺癌，长在我的峡部，请问长在这个位置，有哪些的危害吗？,随着甲状腺峡部结节的增大严重，患者会出现不良反应，比如呼吸道反应。甲状腺峡部结节一旦发生恶变，会引起颈部胀痛，有压迫感，偶尔发生甲状腺峡部结节内出血。甲状腺峡部结节会累及周围组织发生声音嘶哑、呼吸困难、吞咽障碍，并伴随腹泻，血钙降低等症状。
血管瘤,肝血管瘤诊治怎么办？,我爸爸肝脏的情况不是很好，今年78岁了，年轻的时候家庭条件不是很好，所以一直不是很能够善待自己的饮食，最近查出来我爸爸需要接受肝血管瘤诊治，我很担心，怎么办？,肝血管瘤如果病情较严重，会压迫肝脏，影响肝脏的正常功能，有的会破裂出血，造成危险。及时到正规公立医院进行肝胆外科手术检查，明确诊断，专家根据实际情况选择适当的干预或手术方法，效果更好。一定要饮食清淡，避免使用辛辣食物（例如辛辣食物）并戒烟。
血管瘤,血管瘤哪里治疗好?,昨天凌晨，我的二宝出生了。他的额头上有一个鲜红斑痣而且很大。大部分人认为是胎记，医生说是血管瘤，需要治疗。我想问一下血管瘤哪里治疗好？,你好，很高兴为你解答：血管瘤一般是可以通过手术来进行治疗的，血管瘤良性的概率都是比较高的，可以通过手术之后进行病理分析看一下具体情况，同时可以到医院明确诊断之后，面积较小的话，可以通过激光手术来进行治疗，如果面积是比较大的话，可以通过手术来进行切除的。
血管瘤,嘴唇血管瘤治疗是怎么治疗？,我的嘴唇疼痛有已经有两年了，以前的经常出血，而且还有囊肿，现在去医院检查嘴唇现在是得了血管瘤。去了很多家医院治疗，现在都没有治疗好。嘴唇血管瘤治疗是怎么治疗呢？,对于唇部血管瘤的治疗，可以使用激光手术，但这是一种特殊的治疗方法，不易引起问题。嘴唇持续疼痛可能仍然与唇炎有关。如果有囊肿，也应考虑手术。多数血管瘤是良性的，没有问题，一般的手术治疗可以解决，没有心理负担，还需要检查并发症的问题。建议一定要去正规的三甲医院。
肿瘤与疼痛,膀胱高密度影是肿瘤吗,今天CT说膀胱后壁下条片状稍高密度影、性质待定，未见明显占位性病变，这种情况是不是得了膀胱癌啊,根据您所描述目前的情况和症状，建议你比较好可以进一步的做一个病理性的诊断才可以判断的。建议比较好可以多注意观察有效的改善目前情况和症状，促进情况得到恢复。目前的情况我还建议比较好是可以到正规的大医院在去详细的检查后，看下医生是如何给你做详细的分析
血管瘤,眼部会得血管瘤吗？,我家二宝现在差不多有四个月大了，但是最近发现他有点闹，后来就发现他的眼睛有点肿，还有点血丝，会不会是血管瘤的迹象呢？所以我想知道眼部会得血管瘤吗？怎么预防？,您好，这位朋友，现在孩子出现了眼睛肿，血丝，认为是血管瘤的可能性不大的，对于眼睛肿，可以见于眼睑炎，眼睑麦粒肿，认为是与长期的卫生不好，感染细菌有很大关系的，会引起了眼睑部位的红肿，疼痛，需要去医院做个详细检查，如果是有眼睑炎，需外用眼膏治疗合适。
血管瘤,为什么海绵血管瘤治疗后好转又出现紫色？,我孩子之前曾经患有过血管瘤，经过一段时间治疗之后，血管瘤被治疗了，但是现在皮肤上血管的地方出现了紫色，医生，你好，请问为什么海绵血管瘤治疗后好转又出现紫色？,现在的情况主要是海绵状血管瘤治疗以后又出现了血管瘤部位的发紫，需要重新做个复查，如果是疾病复发了，那就需要重新治疗，如果检查是正常的，那就不需要治疗，暂时先观察比较合适，一般对身体影响不大，平时需要注意多休息，合理的饮食，预防各种疾病的发生。
血管瘤,胸椎血管瘤如何治？,前几天带我的岳父去医院检查，因为他一直说身体不舒服，在医院做了一番检查之后，发现竟然得了胸椎血管瘤，这可把我们全家都急坏了，一时不知怎么办好？,您好，这位朋友，胸椎血管瘤的话我们一般不用处理的，因为的话血管瘤一般我们是良性的，然后胸椎血管瘤的话一般是没有症状的，除非是有症状的，我们才要治疗，比如说我们一定要观察血管瘤有无破裂，如果是破裂出血来的话，我们就要治疗的。所以目前我们以观察为主。
血管瘤,海绵状肝血管瘤怎么办？,医生你好，我想请问一下医生，海绵状肝血管瘤怎么办？就是我的一个妹妹，他患有海绵状肝血管瘤，我们也不知道这病是怎么回事，听起来就很复杂的样子，就该怎么治疗呢？,您好，现在主要是海绵状肝血管瘤，对身体是有一定影响的，如果肝血管瘤大于了四厘米以上，那就需要及时的去医院就诊，然后选择合适的方法治疗，通常选择使用微创介入手术治疗，相对效果比较好一些，平时需要合理的饮食，预防各种疾病的发生，有利于疾病的控制。
血管瘤,眼眶海绵状血管瘤是什么原因导致的？,平时我都是自己骑车上下班的，每次我都会带眼镜，但是昨晚下雨走的急就没有带，结果有个东西直接撞进去眼睛里面了，然后睡醒发现疼的不得了，去医院医生就说是眼眶海绵状血管瘤，是什么原因导致的？,朋友您好，现在主要是眼眶部位的海绵状血管瘤，具体引起的原因是很难确定的，可能与先天发育不良有关系，会出现眼睛部位不舒服疼痛，眼睛肿大，所以对身体的影响是存在的，需要尽快做手术切除治疗的，手术以后使用一些抗生素药物和止血药物，这样就可以恢复了。
血管瘤,检查出肝血管瘤怎么办？,医生你好，我想请问一下医生，检查出肝血管瘤怎么办？就是可能和我的生活习惯有关。然后我去医院检查出患有肝血管瘤，我到底该怎么办，能不能够治疗呀？这个病。,朋友，现在主要是有肝血管瘤，认为是先天性发育不良后引起的良性病变，大多数是没有任何症状，也可以出现了肚子胀，肚子不舒服，消化不良等，需要去医院做个肝血管瘤检查，如果是肝血管瘤很大的，那就需要用微创介入手术治疗的，治疗两到三次后就可以控制疾病的。
血管瘤,血管瘤对身体的危害有哪些？,我家宝宝今年5岁了，一出生的时候，眼睛旁边长了个小小的红色的东西，医生说是血管瘤，说是先不用处理，以后等要是长的话就去做手术做掉，现在感觉好像比之前大了许多，我想咨询一下，血管瘤对身体的危害有哪些？,您好朋友，现在主要是眼睛旁边长了血管瘤，对身体的影响是比较大的，出现了眼睛旁皮肤的红色包块，一般没有疼痛，瘙痒，但是会影响美观，监狱服是用激光去除血管瘤治疗，这样才能够控制疾病，平时多休息，避免过于劳累，预防各种疾病的发生，有利于疾病的控制。
血管瘤,毛细血管瘤用什么方法治疗好？,我有一个朋友，就是今年33岁，我也不知道怎么回事，就是最近一段时间他说他不是很舒服，我陪他去医院检查，医生说是毛细血管瘤，想问问医生，毛细血管瘤用什么方法治疗最好？,毛细血管血管瘤是指从毛细血管中生长出来的良性血管瘤。它在头部和面部更为常见。它看起来像深红色或皮下的淡蓝色斑块。如果血管瘤较大，可以选择手术切除。对于较小的血管瘤，也可以考虑使用激光或冷冻疗法。这通常没有明显的不适症状。去医院面诊检查确定血管瘤具体情况后再确定治疗方案。
甲状腺腺瘤,出现甲状腺瘤咋治疗比较好,最近，我发现自己的脖子很不舒服，怎么躺都会感觉到疼痛，睡眠质量明显下降，感觉异常难受，食欲也变得越来越差，请问；出现甲状腺瘤咋治疗比较好,甲状腺瘤是甲状腺疾病中较为严重的一种，甲状腺瘤病程缓慢，临床诊断上可以无任何自觉症状，大多数在数月到数年甚至更长时，部分甲状腺腺瘤可再次发生癌变，癌变率为10-20%。患上甲状腺瘤要及时的予以治疗，治疗亚甲炎方法的决定很重要，一般治疗甲状腺瘤有手术治疗和中医方法治疗，患者应当根据自己的病情来决定恰当的治疗方法。除了治疗腺瘤外，建议患者在日常生活中要留意饮食，并且要始终保持愉快的心情，以此来增强体质加快康复速度。
甲状腺腺瘤,甲状腺瘤需要怎么治较好,家人精神状态不是很好，脸色也总是白白的，让我很是担心呢，请问：甲状腺瘤需要怎么治较好,你好，结合你叙述的情况，建议去医院插手科，在床上诱导下做结节刺击活检细胞学仔细检查，明确其性质再选择治疗方案。如是良性结节建议每隔一年复检一次彩超复杂手术治疗。期望我的推测及建议对你有所帮助，祝你早日康复。腺瘤患者在对症治疗之外，患者在生活中还需要有注意始终保持恰当饮食的好习惯，消化身体营养，期望上述的答案可以帮助到你，谢谢！
甲状腺腺瘤,甲状腺腺瘤应该如何诊治可产生好效果?,一直觉得我自己的身体不是特别的舒服，期就是时常头疼，状很久了，知道这种情况是咋回事，现这种情况很频繁的，了一下可能是甲状腺腺瘤，问甲状腺腺瘤应该如何诊治可产生好效果?,你好，大部分甲状腺癌为分裂性甲状腺癌；不同病理类型的甲状腺癌其病发特点、治疗方式、预后有明显差异；手术治疗为主要治疗措施；放射治疗为主要辅助治疗手段，分泌治疗适用于所有甲状腺癌的治疗，一般不主张化疗；甲状腺癌的治疗同样要遵从个体化原则，可实施中医治疗，瘤这种疾病不易康复，患者朋友理应保持良好的心态，积极的心态去直面它，有这样才能提高患者抗衡腺瘤的信心，因为这样一定能获得康复。
甲状腺腺瘤,看甲状腺瘤去哪看更好,以前查出来是甲状腺结节，没做正规的治疗，现在诊断是甲状腺瘤病，您好下，这个甲状腺瘤去哪个医院治疗?,甲状腺瘤很常见，多见于女性，患者往往有长期甲状腺结节的病史，早期多无症状或仅有轻度的心力，随病情的扩张，甲状腺腺瘤可再次发生癌变，癌变率为10-20%。治疗甲状腺瘤的方法和医院决定很重要，另外患者要在平时给与恰当的护理措施，合理安排工习和生活，确保充足的歇息，防止操劳。另外，可以适当的锻炼身体，这样可以增强体质，增加免疫力。患者直面腺瘤危害，我们应当积极采用治疗措施，不要避忌就诊，如果腺瘤久治不愈，那么就要及时换新治疗方案。
甲状腺腺瘤,甲状腺瘤要怎样治才会好,大夫我上周在做颈椎核磁共振仔细检查时发觉右侧甲状腺瘤，后去做了甲状腺b超，也诊断右侧有两个怎样治疗甲状腺瘤呢？,根据仔细检查结果，考虑良性疾病可能性大。但由于结节较大，目前除手术外没其他方法可以治疗好，建议可以手术治疗，但不必马上。治疗甲状腺瘤的常见治疗手段建议您查一下甲状腺功能看一看甲状腺激素水平的情况，因为甲状腺瘤等是可以引来甲功的发生改变的不定期的复检甲状腺b超，可以每年查2-3次其实得了腺瘤并不可怕，患者要认为自己是可以战胜病魔的，只要在早期发觉的时候及时治疗，纾解病情及康复的几率都非常大。
甲状腺腺瘤,得了甲状腺瘤要如何治疗妥当,最近不知道怎么回事，总是吃不进去东西，特别是油腻的，身体状态不好，去医院进行检查，结果查出了恶性甲状腺瘤，请问；得了甲状腺瘤要如何治疗妥当,甲状腺机能减退症全称甲减，是由多种不同原因引来的甲状腺激素生成、排泄或生物效应不足所致的一种全身分解代谢提高综合征。其病理特征是粘多糖等在组织和皮肤中堆叠，严重者表现为粘液性水肿。患病率约1%，女性较多见，和权威专家面对面交流，患者的饮食状况和护理也是很关键的，患者一定要多看重自身饮食，多吃清淡的食物，以免引发不必要的伤害，谢谢。
甲状腺腺瘤,甲状腺瘤患者怎么治较好,家人精神状态不是很好，脸色也总是白白的，让我很是担心呢，请问：甲状腺瘤患者怎么治较好,你好，甲状腺瘤拥有一种比较严重的甲状腺疾病，治疗极为不易，虽然目前甲状腺瘤的疗法许多，但治疗下来，效果并不理想。建议发觉病情最好及早到正规的医院实施治疗。甲状腺瘤患者不仅要戒，还应当尽量避免肥煎与辛辣刺激性食物，？花等。专家建议，甲状腺疾病患者尽量少吃该类食品，尤其是甲状腺瘤患者，平时注意尽量不喝啤酒，不吃辛辣刺激饮食，足量食用海产品，多吃水果蔬菜，以清淡饮食为基础。
甲状腺腺瘤,患有甲状腺瘤有治疗康复的可能吗?,近期常感觉胸闷，不着觉，抖，便次数增多，重偏瘦，为是心脏功能不医院检查发现是甲状腺腺瘤，在想知道，有甲状腺瘤有治疗康复的可能吗?,甲状腺瘤是临床诊断常见并多发病，中绝大部分为良性炎症，少数为癌，于这个瘤一般是拥有良性的，建议到医院做个仔细检查，能已经影响到了正常生活了，建议实施手术治疗可能效果会更个紫河车可能效果不明显，时留意歇息，食辛辣刺激性的食物，了治疗腺瘤外，建议患者在日常生活中要留意饮食，且要始终保持舒畅的心情，以此来增强体质加快康复速度。
甲状腺腺瘤,甲状腺瘤的治疗需要花费多少,"喉咙两边甲状腺肿大，左侧最大的有49mm*31mm,右侧25.6*20mm，双侧甲状腺左右对称肿胀，其内多发性囊实性混和回音包块，考虑结节性甲状腺肿可能，不排除腺瘤可能甲状腺瘤摘除手术要花费多少钱？",甲状腺肿瘤分性二种。良性肿瘤可分成甲状腺腺瘤和囊肿。恶性肿瘤95%以上为原发性甲状腺癌，极少数可有恶性淋巴瘤及转移瘤。建议到正规医院仔细检查治疗，以最少的钱治疗。甲状腺癌患者手术需要有有多少费用，和患者的病情，身体素质，治疗方法，以及医院标准等有很大关系，一般费用家庭都可以忍受，能手术患者要尽快手术为好。治疗癌症疾病，要尽量到医疗条件好的医院，这样治疗更有确保。
甲状腺腺瘤,得了甲状腺瘤后应该怎么治疗好,家人精神状态不是很好，脸色也总是白白的，让我很是担心呢，请问：得了甲状腺瘤后应该怎么治疗好,甲状腺腺瘤是一种甲状腺良性肿瘤，但是由于可能发生甲亢或恶性变的可能的，多主张手术治疗的。如果不是很大，身体也不能够耐受手术建议还是用不着做手术了，专心仔细观察用不着治疗。腺瘤病情很严重，建议患者马上实行治疗，期望患者可以根据医生的意见对症治疗。同时看重自身的护理工作，恰当饮食，以免加重病情。上述的答案期望可以帮助到您，谢谢。
甲状腺腺瘤,患了甲状腺瘤真的可以治疗好吗,家人精神状态不是很好，脸色也总是白白的，让我很是担心呢，请问：患了甲状腺瘤真的可以治疗好吗,你好，甲状腺瘤可以手术治疗，也可以采取传统中药保守治疗，或者手术后采取有效的传统中药稳固治疗，中医中药长期临床实践累积了很多非常有效的治疗方法。甲状腺瘤建议你用传统中药白鳖精芦癣豆银术鳖翘等互相配合治疗，其功效能在短期内变大肿低痛定病效显著，同时增加机体免疫力，期望你正确治疗，早日康复。
