department,title,ask,answer
卵巢癌,卵巢癌复发后怎么治疗比较好,今年51岁，我有卵巢癌，最近好像复发了，请问；卵巢癌复发后怎么治疗比较好,卵巢癌病发后首先应当经过有经验的妇科肿瘤专家检验，如果病灶可以摘除干净，应当必选再次手术治疗。术后再化疗。如果不能够手术，退其次可以化疗。从您提供的病灶情况，应当都是可以摘除的。建议不要错失再次手术的机会。因为，理论上来说，化疗不可能将肿瘤全部杀净，只有手术方才能切净，化疗可以清除非常微小的病灶，以防再次病发。不过卵巢癌的二次手术是比较难的，没经验和技巧难以达到的医生通常不主张。因此，应当注意区别究竟是确实不宜手术，还是其他。仅供参考。
口腔癌,得了口腔癌有什么症状？,男，27岁不知道会是什么情况，后来才知道是得病了，请问：得了口腔癌有什么症状？,患者口腔内会有红色的肿块，局部有炎症，再次出现破溃，口腔无缘无故的出血，感觉到麻木和灼热，还可能导致干咽都遭到影响。患者在诊断得了口腔癌之后，需要积极的治疗，可以手术治疗时要尽快手术，术后互相配合放化疗或者是中药治疗来预防工作癌细胞的扩散与病发。
卵巢癌,卵巢癌复发怎么治疗好,今年53岁，我有卵巢癌，最近好像复发了，请问；卵巢癌复发怎么治疗好,根据上述情况建议盆腔积液的治疗要从消除炎症已经开始，建议使用外用药物治疗，对盆腔炎盆腔积液起些很好的效用，另外要注意日常的护理，注意卫生，惯良好的阴部清洁习惯，增强经期产后的卫生，勤换内裤及卫生巾，多喝水，多吃清淡有营养的实物，并始终保持乐观向上的生活态度。
卵巢癌,卵巢癌可以治疗好治疗好的吗,今年50岁，最近月经不准，而且腹部疼，阴道流血，朋友说这是卵巢癌的症状，请问；卵巢癌可以治疗好治疗好的吗,卵巢癌属于恶性肿瘤中，预后相对比较差的，但如果发觉的比较早，还是有缓解的可能会的一、卵巢癌病人饮食宜清淡，不食或少食高剂量乳糖以及过多的动物脂肪。二、饮食不偏嗜，多食用含有纤维素、微量元素及纤维素类食品，如香菇、黄豆、新鲜的蔬菜、冬菇及甲鱼、海带、紫菜、牡蛎等等。三、不食用烟熏、霉烂、所含亚硝酸盐食物，少吃油炸、辛辣、腌渍的食物，不抽烟、不吸毒、不暴饮暴食。
卵巢癌,卵巢癌怎么治疗较好呢,今年44岁，最近月经不准，而且腹部疼，阴道流血，朋友说这是卵巢癌的症状，请问；卵巢癌怎么治疗较好呢,卵巢癌的治疗以手术摘除癌肿为必选，辅之以放射治疗、化疗药物治疗及中医保守治疗等。最后，在生活中除了要注重治疗效果之外，还要要保持良好的心情，好的心情对疾病的恢复很有帮助。不仅如此，日常饮食也是要格外注意的，健康饮食对于病情恢复有很大帮助，甚至还有辅助治疗的功效，所以平时需要清淡饮食，规律作息。
肿瘤疾病,癌症晚期能治疗好吗,50岁，我爸爸最近吃不下饭，脸也白白的，我很担心，请问；癌症晚期能治疗好吗,目前临床诊断上对于癌症晚期还没有能完全缓解的方法，只好通过化学治疗、放射治疗、药物靶向治疗等方法纾解病情，尽量延长患者的生活时间。平时患者要多吃高蛋白、高热量、高维生素的食物，消化营养，能大幅提高免疫力，减低化疗的毒副反映。最后，患者日常要养成良好的生活习惯，规律作息，禁烟酒，多增加日常锻炼以此来提高患者免疫力，好的习惯对预防疾病是有一些帮助的。
肺癌,怎么有效的对肺癌进行治疗,男，今年80岁，这两天出现咳嗽，咳痰而且痰中带血，有胸闷胸痛，请问；怎么有效的对肺癌进行治疗,"咳、咳血是肺癌临床诊断常见症状，中晚期患者多已丧失了手术机会，可考虑理解中医中药治疗以滋阴润肺、活血化瘀、软件散结等中药抑止癌肿扩张，纾解咳、咳血等症状，大幅提高生活质量最大程度延长患者生活时间。对癌症病人来说,以防病发扩散、延长性命、大幅提高性命质量，比任何事都重要。"
卵巢癌,卵巢癌早期症状有什么？,女.29岁，知道身体有不适的感觉，就没用去看，请问：卵巢癌早期症状有什么？,卵巢癌早期症状：1、胃肠道症状：更年期女性如果经常感觉腹痛、食欲不振，经消化科仔细检查没发觉胃肠道疾病，此时需去妇科复诊。因为卵巢肿瘤会使周围的韧带遭到压制、牵拉，而且腹水剌激，往往会再次出现胃肠道症状。2、腰腹部疼痛：与卵巢相邻的组织如遭到癌肿浸染或再次发生黏连，易引来腰腹部隐痛、钝痛。3、外阴及下肢水肿：随着卵巢癌肿的减小，盆腔静脉受压，导致血流不畅，防碍淋巴回流，而使外阴及下肢再次出现水肿。
卵巢癌,卵巢癌早期有什么症状？,女.27岁，知道身体有不适的感觉，就没用去看，请问：卵巢癌早期有什么症状？,经过长期临床实践证实，卵巢癌早期的确会有一连串症状。如腹部的持继浮肿，有压迫感及疼痛，肠胃不适，进食困难或者极易有饱餐感，尿频或尿急等。只不过是由于这些症状类似于一般的消化系统症状和胃肠功能紊乱，许多时候并不引人注意，甚至许多医生也对此非常忽略。
鼻咽癌,鼻咽癌晚期多长时间能医治较好？,本人男48岁，因为工作中突然感到了不适，去检查后竟然得了这个病，请问：鼻咽癌晚期多长时间能医治较好？,由于鼻咽癌的病发部位较隐蔽，早期症状很轻微，常常不引来人们的注意，有的需要有3到5年，10年或者更长时间。鼻咽癌是有一定的潜伏期的，所以我们在日常生活中，要注意自己身体的细微变动，这样才能早期发现自己如何得鼻咽癌。早期鼻咽癌特征并不明显，所以很容易被忽略。绝大部分患者是因发觉颈部肿块或其他扩散症状后才被诊断，从而丧失治疗的时机。
肺癌,肺癌转骨癌的治疗方法是什么？,本人31岁男精神最近不是很好，然后才得知生病了，请问：肺癌转骨癌的治疗方法是什么？,化疗期间骨髓瘤患者应多饮水，每日入液量不少于3000ml，并碱化尿液，准确记录液量，保持水电解质平衡。用药方面，药物能增加免疫功能，用来抗衰老化疗、放射治疗的配置治疗，老年性免疫功能缺点等。可互相配合化疗、放射治疗及联合应用于白血病、多发性骨髓瘤、骨髓增生异常综合症及造血干细胞移植后，以及其他实体瘤
肿瘤疾病,贲门胃体恶性肿瘤术后九个月怎么护理,我爷爷今年59岁，身体很不舒服，前段时间体检，说得了肿瘤。请问：贲门胃体恶性肿瘤术后九个月怎么护理,现在看的话，伤口的地方是没肿瘤的复发的，考虑是有一点炎症建议您专心积极的药物治疗，同时要不定期的复检，现在这个情况的话是需要有每个月都要复检的。饮食上面营养要丰富高蛋白饮食。恶性肿瘤对患者们带给的危害是非常大的，一旦发觉自身的症状，就要及时就诊诊病，同时多看重饮食问题，以清淡食物为基础，期望恶性肿瘤患者能获得专业治疗。
肿瘤疾病,恶性肿瘤没做手术可不可以喝营养液？,我母亲54岁肚子有腹水，有大的恶性肿瘤，发烧了四天了，一直三十八度肺部有传染；用药一直没消炎；还能再坚持 多长时间，因为长期卧床，肿瘤手术有风险现在做手术有风险，插了鼻管；只好喝流食那么用什么来补充营养比较好？,应当属于肿瘤的晚期，已再次出现了腹水，可能会是肝脏腹腔的扩散，导致的低蛋白血症引起的腹水。发烧与身体抵抗力差，病原你传染关于，治疗可以采用，静脉补液输注，白蛋白，氨基酸脂肪乳，改正水电解质平衡内分泌失调，以稳定症状，延长生活时间。对于恶性肿瘤严重患者来说，建议尽快就诊，根据医生的意见来尽快治疗，不要盲目的使用药物，以免严重病情。
肿瘤疾病,肺部als是癌症吗,我一位男同事，36岁，体检说肺部有4mm结节，Als可能性较大。请问：肺部als是癌症吗,目前结节很小，需要有复检，太小了没办法定性。但是根据经验定性应该是肺癌早期，病理类型是腺癌。需要有进一步仔细检查方才能明确具体的原因。你好，从你叙述的情况来看，如果质疑是肺部的问题致使的，可以考虑实施拍个胸片，或者实施肺部ct的仔细检查，可以明确您胸闷以及呼吸困难的具体原因。
肿瘤疾病,高危型hpvmrna阳性是什么意思,hpv其他12种高危阳性什么意思？，16，18型都是阴性，这个是宫颈癌？还是性病？,你好！37岁，女性，医院行人乳头瘤病毒检查显示高危型阳性，这只是代表有病毒感染而已，不代表有宫颈癌。只要能通过性生活传播的都可以归为性病，所以这也是性病，如果做了TCT检查，结果是正常的，那就继续观察，如果TCT结果不正常，建议做阴道镜检查。
甲状腺腺瘤,甲状腺瘤的早期症状是什么原因引起的？,女.52这几天浑身无力上楼小腿软，心电图是三联律去医院查说甲状腺腺瘤，请问；甲状腺瘤的早期症状是什么原因引起的？,一般来说甲状腺内的新生物称甲状腺肿瘤，甲状腺肿瘤也有良性与恶性之分，甲状腺肿瘤是属于临床诊断上的常见病、多发病。其病发因跟地区性，性别有很大的区别甲状腺肿瘤好发于颈前部，形状似核桃，质地较硬，可随干咽而上下运动的颈部慢性病变。病发的主要因素是由于长期的愤恨或忧郁愁闷，使肝气郁滞，进而津液，气血郁结僵滞，久聚成痰，气滞痰凝，痰气交阻，聚结了颈前而演化出。其次，还与水土，饮食、体质等因素关于。本病病因不清，病理发生改变为甲状腺滤泡增生，甲状腺组织肿胀。
肿瘤疾病,hpv第三针是可以提前打吗,请问一下我第一针在2月8号打得，第二针推迟了打4月20号左右，第三针原本是8月8号，因为个人有急事，可以提前三四天左右先打吗,你好，很高兴为你解答问题：打完了HPV疫苗，你想什么时候吃减肥药都可以的，这个对疫苗的效果没有什么影响的。建议如果减肥，可以慢慢来，不能一下子。减得太快，瘦得太快的话，容易引起妇科没分泌紊乱，月经失调，具体情况建议去咨询一下，希望我的回复对你能有帮助。
肿瘤疾病,甲胎蛋白值是38属于癌症吗,今年39岁算是高龄产妇吧，三个月之前去医院体检的，感觉自己身体一切都正常，今天去医院体检，医生告诉我甲胎蛋白38不太正常的，那么我想知道下胎蛋白38严重吗？,关于甲胎蛋白，指数是38。当修复轻度肝炎时，甲胎蛋白也会略有增加，所以不要太紧张。肝癌甲胎蛋白将高于400并逐渐增加。只要有肝炎，甲胎蛋白就会或多或少升高。我建议你放松心态，注意你的饮食，少吃油腻辛辣的食物，多吃蔬菜水果，保持一个良好的习惯，少喝酒，少抽烟，它会慢慢下降的。
肿瘤疾病,20岁了要不要做hpv检测,HPV高危阳性，能同房吗，怎么导致的呢，能治疗的好吗，现在都有点担心了，也不知道主要是什么原因导致得,你好，很高兴为你解答问题：对于根据你的描述，对于hpv病毒感染，是可以同房的。hpv感染不等于尖锐湿疣，这个病毒本身有一定的自限性大部分会自行缓解，在治疗方面可以适当的用一些抗病毒和调节免疫的药物。具体情况建议去咨询一下，希望我的回复对你有帮助。
肿瘤疾病,NBI示局部不规则是什么意思,女性，56岁。做了胃镜，取了病理。NBI示局部腺管不规则。不知道肠化生的概率有多少，也不知道情况严重不严重。,你好，依据你的叙述，腺管不规则，考量可能会是腺上皮异常纤维化的可能会，建议你不要忧心，保持良好的情绪，在此期间，可根据当地医生的指导意见积极救治，可以服食奥美拉唑等，禁术辛辣等刺激性的食物，饮食以清淡易消化为基础。这种情况必须引来高度重视，肠化生的概率一般在80%以上。
肺癌,治疗肺癌早期的方法有那些？,本人22岁男精神最近不是很好，然后才得知生病了，请问：治疗肺癌早期的方法有那些？,您说的这种情况，必须获得医院去仔细检查，让医生给你仔细地仔细检查病情的所有状况，然后确认个具体的治疗方案，这种情况不是之后在家能治疗的。要明确肺癌病理类型及分期付款，对患者，整体状态全面检验，决定合适的方法，积极治疗，稳定症状，延长生存期。这是治疗的主要目的，在家没办法办到。
肺癌,胡萝卜汁怎么喝治肺癌,专家您好，我家爷爷今年56岁，目前已经确诊肺癌，我想问问胡萝卜汁怎么喝治肺癌,1、胡萝卜汁肺癌患者可以喝，但别的用不着就靠它一定不行了。2、喝有多少我说不好，一天三五百毫升没问题，加糖是可以的；3、靶向治疗都是口服药，很贵，但副作用多数会低于化疗，但是概率上说对男性抽烟患者效果可能会比较差，而且对鳞癌效果也差。祝福患者早日缓解，具备健康的身体和美好的生活。
肿瘤疾病,纤维上皮性肿瘤癌变吗,我前几天去医院做检查，医生说我得了纤维上皮性肿瘤，让我做手术切除，我回来后很担心会变成癌症，所以想问一下纤维上皮性肿瘤癌变吗？,癌症严格来说不是癌症。癌症有良性肿瘤和恶性肿瘤两大类:从医学病理学角度看，癌症和肉瘤。普通人知道癌症是恶性的。他们不知道医生在检查后如何分析你的情况。有什么治疗建议吗？一般来说，这需要积极治疗。饮食应该清淡，不要吃辛辣刺激的食物。比较好在医生的指导下来进行治疗
肿瘤疾病,女性血沉22会是肿瘤吗,我去医院进行常规查体，然后抽血查了一个血沉，但是医生看了结果以后让我做好思想准备，然后让我再去做一个别的检查，血沉22是有肿瘤吗？,这种血沉的全称是红细胞沉降率。电子自旋共振是非特定的测试项目。也就是说，血沉的加速并不决定血沉正常的疾病，也不意味着没有疾病。血沉可以了解疾病，观察疾病的发展变化。需要结合其他测试结果和临床数据来诊断该疾病。检查后医生是如何为你做疾病分析的？
肺癌,信迪利单抗能治肺癌吗,信迪利单抗绝不是只能治疗霍奇金淋巴瘤，目前信迪利单抗治疗各种癌症的临床试验有20多项，这些癌症包括肺癌、肝癌、胃癌、食管癌，信迪利单抗能治肺癌吗？,肺癌是世界上发病率和死亡率最高的恶性肿瘤。非小细胞肺癌占所有肺癌病例的80%-85%。一般来说，可切除的非小细胞肺癌患者在手术治疗后会面临复发困境，迫切需要新的治疗方法来改善预后。辛迪利珠单抗绝不是霍奇金淋巴瘤的唯一治疗方法。目前，辛地利珠单抗治疗多种癌症的临床试验已超过20项，包括肺癌、肝癌、胃癌、食道癌等。
肺癌,肺癌患者可以吃板栗吗,男，57岁，大伯平时肺就不太好，平时没事老喜欢抽烟，最近因为咳的厉害，去医院检查出是得了肺癌，请问肺癌患者可以吃板栗吗,肺癌患者可以吃板栗，生存上必须留意忌腥油腻食物，不能够吃，烟、酒等刺激性食物更不能够碰。比如：螃蟹、海带、虾和无鳞鱼等，包括加碘食品和加碘盐等。吃了这些食物，肿块会破溃。碘剂广泛拥有于海水之中，碘剂可以迫使软组织溶化，因而具备凉血效用，对于良性肿瘤和血管硬化，有好处。
肿瘤疾病,得了癌症怎么治疗呢,我妈妈51岁，得了癌症，我是高考完之后才知道的，因为前些日子我在备战高考，所以家里人为了不让我分心，一直没有告诉我这个消息，请问，得了癌症怎么治疗呢,你好，对于癌症的治疗最好能考虑进行综合性的治疗。如手术、化疗、放射治疗以及中药的调养。这并非是哪一种方法就可以摆平的。中药的动用也必须得先进行辨证论治。中药对于癌症的治疗主要是起一定的调养效用。与化疗药物互相配合可以缓解化疗药物的副作用。大幅提高身体素质。期望我的解释能帮助到你!
肺癌,左右肺都有癌是几期,女，31岁，平时工作上压力特别大，养成了吸烟减压的不良习惯，近期去体检发现得了肺癌，想问问左右肺都有癌是几期,左右肺都有癌大多数都是癌症晚期了，建议患者在身体容许的情况下手术治疗。如果不能够手术就要采用放射治疗了，但是放射治疗有很大副作用。肺癌的病因至今尚不完全明确，大量资料证明，长期大量抽烟与肺癌的发生有非常密切的关系。已有的试验证明：长期大量吸烟者患肺癌的概率是不吸烟者的10～20倍，已经开始抽烟的年龄越小，患肺癌的几率越高。此外，抽烟不仅直接影响本人的身体健康，还对周围人群的健康产生不良影响，致使弱势吸烟者肺癌患病率明显增加。
肺癌,肺癌腿疼得走不了路是晚期吗,女，56岁，自己家婶婶近一段时间特别的憔悴，问了问才发现她得了肺癌，现在她特别后悔养成了抽烟的坏毛病，想在这帮她问问，肺癌腿疼得走不了路是晚期吗,要看情况而具体分析。一般情况下病理活检是诊断癌症的金标准，病人这个情况一是因为活检选材不合理，找不到癌细胞；二是错诊，需要有融合其他检查（PET-CT等）进一步诊断。如果是前者，临床诊断也较多见，需要有二次取病理再检查下。肺癌目前主要的治疗手段有手术，放射治疗，化疗，靶向药物，自动免疫疗法，以及中医中药等，需要有融合患者病理，肿瘤分期付款以及身体状况等因素综合评价考虑。肺癌晚期患者出现腿疼，必选需要有剔除有否骨转移可能性，必要时可以做个全身骨显像检查看一看。
肿瘤疾病,化疗输液港还是picc好,我在前段时间就摸到胸部有一个肿块出现，后来医生检查，发现我是患有乳腺癌，我现在正在化疗治疗，请问化疗用picc管好还是输液港比较好？,化疗用输液港比较好，输液港和PICC均为输液方式，但PICC治疗间隔期仍需外导管，存在感染几率大、导管堵塞概率高、护理繁琐、导管留置侧肢体肿胀、活动受限等问题。输液口导管相关并发症少，更安全有效，成本效益高，应用广泛，护理简单，能更好地提高患者的生活质量，减少临床护士的工作量，值得在临床癌症患者中进一步推广应用。
肿瘤疾病,dp方案化疗的副作用,我母亲患卵巢癌晚期，已手术将子宫，卵巢，大网膜等等全部切除，现准备做正式的化疗，方案为PT的，请问dp方案化疗的副作用？,消化道系统如恶心、呕吐等是肺癌化疗的常见副作用。要预防化疗恶心，可在运用化疗药物前提前使用止吐药。同时放、化疗后恶心、呕吐、腹泻及脱发等体征明显，使用抗癌扶逆疗法中药对胃肠功能起到双向调节功能，即促进了胃肠蠕动，使胃气下降。这些都是dp方案化疗的副作用。
肿瘤疾病,化疗期间需怎样配合饮食呢,我刚做完乳腺癌全切除手术，9月10日开始做第一期化疗，这两天拉，吐特别历害，吃不下东西，请问在化疗期间需怎样配合饮食呢？,少吃多餐，让病人想吃就吃，注意食物的色，香，味，形。多酸甜，少苦辣，放化疗病人对甜味和酸味的感觉弱，对苦味较为敏感，所以应该适当增强酸甜食物。日常饮食宜清淡，注意上面多酸甜是适当多吃酸甜的食物，而不是吃太酸甜的东西，尤其不要给病人吃太甜的食物。另外做菜时要尽量根据患者对咸淡的感觉调节食盐的用量。
鼻咽癌,鼻咽癌可不可以医治较好？,本人男，61岁患病也有很长时间了，但是一检查才发现是这病，请问：鼻咽癌可不可以医治较好？,鼻咽癌是可以治好的，及早发觉及时治疗，大幅提高治愈率。鼻咽癌治愈率和自身状况、病情扩张程度、肿瘤位子以及决定的治疗方法有关，建议您及时去医院治疗，控制病情的扩张，始终保持心情舒畅。然后，患者要注意保持清淡饮食、心情舒畅，避免熬夜和晚睡，保证足够的睡眠时间，其次是保持运动的习惯，在日常生活中也要切忌过饥或过饱，也不能暴饮暴食。
肿瘤疾病,药物化疗有什么副作用,肠内肿瘤伴淋巴瘤，肠镜检查回盲部有一肿物，取病理检查为淋巴瘤，手术切除肠套叠约30厘米，药物化疗有什么副作用？,如果是进行进步的化疗的话，那么考虑毒副作用是比较大的。但是化疗对于身体来说，对于癌症患者来说，效果是非常好的。建议在化疗的同时是可以搭配一些中草药来缓解化疗的副作用。另外还可以适当的提升患者的一个抵抗力建议中西医结合。化疗药物对患者的正常细胞有很大的损伤，比较常见的副作用是骨髓移植，免疫下降，白细胞低，消化道反应如食欲不振，恶心呕吐等，以及一些肝肾脏损伤，神经毒性等。
乳腺癌,乳腺癌可以纹眉毛吗,乳腺癌放化疗做完了以后眉毛也掉光了，就想试一试纹眉，得了乳腺癌以后还可以纹眉吗，会不会有什么不好的反应？,如果是乳腺癌的情况，那么考虑这个时候还是不要纹眉比较好。那么如果在这个过程中，导致出现有感染的情况，对于身体来说会有很大的影响，所以这个时候建议还是需要慎重考虑。而且乳腺癌放化疗之后，那么身体的抵抗力是比较弱的。因为本身放化疗后皮肤就比较脆弱，这时候还去烧灼他，可能会引起感染，得不偿失，可以试一试画眉毛呀。
乳腺癌,乳腺癌ofs是什么意思,我姐姐今年才30多岁，前两天开始出现乳房有肿块，就去医院做了检查，医生说是乳腺癌前病变，这是什么意思？,乳腺癌癌前病变简单的来讲就是指的当前的情况有可能发展成癌，但是还未到达癌变的阶段，只是出现了乳腺病变，一般情况下，常见于乳腺增生，乳房有肿块，结节，乳腺炎等。还是建议尽快接收治疗，避免后期发生癌变，影响治疗效果。和家族遗传易感性以及个人的体质等都是有一定关系的，其中有家族乳腺癌病史的乳腺癌发病的几率会相对较高。
肿瘤疾病,mtx化疗针用了会虚胖吗,我在半年前被查出得了肝癌，一直在治疗中，手这几天我发现我开始胖了，不能一下子就胖起来，家里人说可能是打化疗针的事，请问一下mtx化疗针用了会虚胖吗？,化疗后身体肥胖主要是激素的副作用，等化疗结束后，激素慢慢减量后，症状会慢慢改善，但是坚决杜绝私自停药，会引起病情的反复，可能导致加重，可以服用中药进行调理，中药一般没有副作用，这样症状会明显改善。也可以选择口服中药治疗，治标治本，直达病灶，效果非常的理想。
乳腺癌,老公经常亲乳头会得乳腺癌吗,我今年38岁，我老公经常亲我乳头，我想问一下这种情况会得乳腺癌吗？,经常这样与乳腺癌的关系并不是很大的，不需要担心的。乳腺癌和所有的恶性肿瘤一样，是可以通过血行，淋巴和种植转移的，但具体的病因都是不是很明确的，对女性的健康危害是很大的，所以上述情况是和乳腺癌没有必然的联系的，适度的良好的性生活是促进夫妻双方感情和缓解生活压力是有很大的好处的。
乳腺癌,得了乳腺癌怕劳累吗,之前总是感觉乳房不适，去医院检查出患有乳腺癌已经通过手术治愈了，最近这段时间工作有些劳累，感觉乳房又开始不适，想咨询一下乳腺癌过度劳累会复发吗？,乳腺癌过度劳累是有复发的可能，如果感觉身体不舒服，建议及时到正规医院做详细检查，看是否有复发的迹象，如果出现复发情况，建议及时进行治疗，治疗期间要注意休息，不要过度劳累，晚上不要熬夜，养成良好的生活习惯，以免出现再次复发的情况。多发于双侧肺。晚期转移出现胸痛、干咳、咯血等症状，有时出现胸腔积液。
